fecha_publicacion|publicacion|diario_numero|sumario_id|sumario_url_pdf|seccion_codigo|seccion_nombre|departamento_codigo|departamento_nombre|epigrafe_nombre|item_id|item_titulo|item_url_pdf|item_url_html|item_url_xml|texto|szKBytes
20240907|BOE|217|BOE-S-2024-217|https://www.boe.es/boe/dias/2024/09/07/pdfs/BOE-S-2024-217.pdf|1|I. Disposiciones generales|9562|MINISTERIO DE ASUNTOS EXTERIORES, UNIÓN EUROPEA Y COOPERACIÓN|Tratados internacionales|BOE-A-2024-18004|Acuerdo entre el Reino de España y el Gobierno de la República de Namibia, sobre actividad remunerada de los familiares dependientes del personal diplomático, consular, administrativo y técnico de las Misiones Diplomáticas y Oficinas Consulares, hecho en Madrid el 15 de junio de 2022.|https://www.boe.es/boe/dias/2024/09/07/pdfs/BOE-A-2024-18004.pdf|https://www.boe.es/diario_boe/txt.php?id=BOE-A-2024-18004|https://www.boe.es/diario_boe/xml.php?id=BOE-A-2024-18004||208
20240907|BOE|217|BOE-S-2024-217|https://www.boe.es/boe/dias/2024/09/07/pdfs/BOE-S-2024-217.pdf|1|I. Disposiciones generales|5140|MINISTERIO DE HACIENDA|Tabaco. Precios|BOE-A-2024-18005|Resolución de 6 de septiembre de 2024, de la Presidencia del Comisionado para el Mercado de Tabacos, por la que se publican los precios de venta al público de determinadas labores de tabaco en Expendedurías de Tabaco y Timbre del área de Península y Baleares.|https://www.boe.es/boe/dias/2024/09/07/pdfs/BOE-A-2024-18005.pdf|https://www.boe.es/diario_boe/txt.php?id=BOE-A-2024-18005|https://www.boe.es/diario_boe/xml.php?id=BOE-A-2024-18005||233
20240907|BOE|217|BOE-S-2024-217|https://www.boe.es/boe/dias/2024/09/07/pdfs/BOE-S-2024-217.pdf|1|I. Disposiciones generales|9590|MINISTERIO DE EDUCACIÓN, FORMACIÓN PROFESIONAL Y DEPORTES|Formación profesional|BOE-A-2024-18006|Real Decreto 711/2024, de 23 de julio, por el que se establece el Curso de especialización de Formación Profesional de Grado Medio en Coordinación del personal en reuniones profesionales, congresos, ferias, exposiciones y eventos y se fijan los aspectos básicos del currículo.|https://www.boe.es/boe/dias/2024/09/07/pdfs/BOE-A-2024-18006.pdf|https://www.boe.es/diario_boe/txt.php?id=BOE-A-2024-18006|https://www.boe.es/diario_boe/xml.php?id=BOE-A-2024-18006||341
20240907|BOE|217|BOE-S-2024-217|https://www.boe.es/boe/dias/2024/09/07/pdfs/BOE-S-2024-217.pdf|1|I. Disposiciones generales|9595|MINISTERIO PARA LA TRANSFORMACIÓN DIGITAL Y DE LA FUNCIÓN PÚBLICA|Subvenciones|BOE-A-2024-18007|Real Decreto 764/2024, de 30 de julio, por el que se regula la concesión directa de subvenciones por razones de interés público, social y económico para apoyar a la organización del South Summit España en Madrid.|https://www.boe.es/boe/dias/2024/09/07/pdfs/BOE-A-2024-18007.pdf|https://www.boe.es/diario_boe/txt.php?id=BOE-A-2024-18007|https://www.boe.es/diario_boe/xml.php?id=BOE-A-2024-18007||288
20240907|BOE|217|BOE-S-2024-217|https://www.boe.es/boe/dias/2024/09/07/pdfs/BOE-S-2024-217.pdf|2A|II. Autoridades y personal. - A. Nombramientos, situaciones e incidencias|1820|CONSEJO GENERAL DEL PODER JUDICIAL|Nombramientos|BOE-A-2024-18008|Real Decreto 837/2024, de 30 de julio, por el que se nombra Decano de los Juzgados de Fuengirola (Málaga) al Magistrado don Miguel Ángel Aguilera Navas.|https://www.boe.es/boe/dias/2024/09/07/pdfs/BOE-A-2024-18008.pdf|https://www.boe.es/diario_boe/txt.php?id=BOE-A-2024-18008|https://www.boe.es/diario_boe/xml.php?id=BOE-A-2024-18008|De conformidad con lo establecido en los artículos 166.1 de la Ley Orgánica 6/1985, de 1 de julio, del Poder Judicial, y 79 del Reglamento 1/2000, de 26 de julio, de los Órganos de Gobierno de Tribunales, y la elección efectuada por la Junta de Jueces de Fuengirola, celebrada el día 9 de julio de 2024, por Acuerdo de la Comisión Permanente del Consejo General del Poder Judicial, en su reunión del día 24 de julio de 2024, Vengo en nombrar Decano de los Juzgados de Fuengirola (Málaga) a don Miguel Ángel Aguilera Navas, Magistrado titular del Juzgado de Primera Instancia número 3 de dicha ciudad. Dado en Palma, el 30 de julio de 2024. FELIPE R. El Ministro de la Presidencia, Justicia y Relaciones con las Cortes, FÉLIX BOLAÑOS GARCÍA|187
20240907|BOE|217|BOE-S-2024-217|https://www.boe.es/boe/dias/2024/09/07/pdfs/BOE-S-2024-217.pdf|2A|II. Autoridades y personal. - A. Nombramientos, situaciones e incidencias|9585|MINISTERIO DE LA PRESIDENCIA, JUSTICIA Y RELACIONES CON LAS CORTES|Destinos|BOE-A-2024-18009|Resolución de 2 de septiembre de 2024, de la Subsecretaría, por la que se resuelve la convocatoria de libre designación, efectuada por Resolución de 28 de mayo de 2024.|https://www.boe.es/boe/dias/2024/09/07/pdfs/BOE-A-2024-18009.pdf|https://www.boe.es/diario_boe/txt.php?id=BOE-A-2024-18009|https://www.boe.es/diario_boe/xml.php?id=BOE-A-2024-18009|Por Resolución de 28 de mayo de 2024 (BOE de 1 de junio de 2024) se anunció para su cobertura, por el procedimiento de libre designación, unos puestos de trabajo en el Ministerio de la Presidencia, Justicia y Relaciones con las Cortes. De acuerdo con lo previsto en el artículo 20.1.c) de la Ley 30/1984, de 2 de agosto, de Medidas para la Reforma de la Función Pública, una vez acreditada la observancia del procedimiento establecido en el título III, capítulo III del Real Decreto 364/1995, de 10 de marzo, por el que se aprueba el Reglamento General de ingreso del personal al servicio de la Administración General del Estado y de provisión de puestos de trabajo y promoción profesional de los Funcionarios Civiles de la Administración General del Estado, así como el cumplimiento de los requisitos y especificaciones exigidos en la convocatoria, esta Subsecretaría ha dispuesto: Resolver la convocatoria de referencia según se detalla en el anexo de la presente resolución. El régimen de toma de posesión del destino adjudicado será el establecido en el artículo 48, al que remite el 57, del Reglamento General antes citado. Contra la presente resolución que pone fin a la vía administrativa, podrá interponer recurso contencioso-administrativo ante el Tribunal Superior de Justicia de Madrid, con arreglo a lo dispuesto en los artículos 10.1.i), 14.2 y 46.1 de la Ley 29/1998, de 13 de julio, reguladora de la Jurisdicción Contencioso-Administrativa, en el plazo de dos meses a contar desde el día siguiente al de su publicación en el «Boletín Oficial del Estado», o potestativamente y con carácter previo, recurso potestativo de reposición en el plazo de un mes ante el mismo órgano que lo dicta conforme a lo previsto en los artículos 123 y 124 de la Ley 39/2015, de 1 de octubre, del Procedimiento Administrativo Común de las Administraciones Públicas. Madrid, 2 de septiembre de 2024.–El Subsecretario de la Presidencia, Justicia y Relaciones con las Cortes, P.D. (Orden PCM/318/2022, de 11 de abril), la Directora General de Servicios, María Rosario Gálvez Vicente. ANEXO Adjudicación convocatoria Resolución de 28 de mayo de 2024, de la Subsecretaría (BOE de 1 de junio de 2024) Puesto adjudicado Puesto de procedencia Datos personales del adjudicatario/a Nº orden Denominación Nivel Localidad Ministerio, centro directivo, provincia Nivel Apellidos y nombre NRP/DNI Subsecretaría de la Presidencia, Justicia y Relaciones con las Cortes Dirección General de Servicios Subdirección General de Gestión Económica 1 Subdirector Adjunto / Subdirectora Adjunta. Código de puesto: 3913825. 29 Madrid. Ministerio de la Presidencia, Justicia y Relaciones con las Cortes. Subsecretaría de la Presidencia, justicia y Relaciones con las Cortes. Madrid. 29 Cernadas Calvo, Laura María. ***1594*68 A2060 PRESIDENCIA DEL GOBIERNO A.P. Gabinete de la Presidencia del Gobierno A.P. Departamento de Seguridad Nacional A.P. Dirección Operativa del Departamento de Seguridad Nacional A.P. 2 Puesto de Trabajo N16. Código de puesto: 3735710. 16 Madrid. Ministerio de Defensa. Dirección General de Armamento y Material. Madrid. 17 Gómez Sánchez-Aguilera, Carlos. ***6564**|208
20240907|BOE|217|BOE-S-2024-217|https://www.boe.es/boe/dias/2024/09/07/pdfs/BOE-S-2024-217.pdf|2A|II. Autoridades y personal. - A. Nombramientos, situaciones e incidencias|9590|MINISTERIO DE EDUCACIÓN, FORMACIÓN PROFESIONAL Y DEPORTES|Nombramientos|BOE-A-2024-18010|Orden EFD/929/2024, de 30 de agosto, por la que, en ejecución de sentencia, se modifican la Orden EFD/1369/2023, de 18 de diciembre, dictada a propuesta de la Consejería de Educación, Ciencia y Universidades de la Comunidad de Madrid, y la Orden EFD/673/2024, de 17 de junio, dictada a propuesta de la Consejería de Educación, Ciencia y Formación Profesional de la Comunidad Autónoma de Extremadura, por las que se nombra personal funcionario de carrera de varios cuerpos docentes como consecuencia de los procedimientos selectivos extraordinarios de estabilización convocados respectivamente por Resolución de 11 de noviembre de 2022 y Resolución de 14 de noviembre de 2022.|https://www.boe.es/boe/dias/2024/09/07/pdfs/BOE-A-2024-18010.pdf|https://www.boe.es/diario_boe/txt.php?id=BOE-A-2024-18010|https://www.boe.es/diario_boe/xml.php?id=BOE-A-2024-18010||203
