fecha_publicacion|publicacion|diario_numero|sumario_id|sumario_url_pdf|seccion_codigo|seccion_nombre|departamento_codigo|departamento_nombre|epigrafe_nombre|item_id|item_titulo|item_url_pdf|item_url_html|item_url_xml|texto|szKBytes
20240829|BOE|209|BOE-S-2024-209|https://www.boe.es/boe/dias/2024/08/29/pdfs/BOE-S-2024-209.pdf|5A|V. Anuncios. - A. Contratación del Sector Público|9565|MINISTERIO DE CIENCIA, INNOVACIÓN Y UNIVERSIDADES||BOE-B-2024-30377|Anuncio de formalización de contratos de: Presidencia de la Agencia Estatal Consejo Superior de Investigaciones Científicas, M.P. Objeto: Servicio de soporte, gestión y administración de equipos informáticos para el Instituto de Investigaciones Biomédicas de Barcelona. Expediente: 32486/24.|https://www.boe.es/boe/dias/2024/08/29/pdfs/BOE-B-2024-30377.pdf|https://www.boe.es/diario_boe/txt.php?id=BOE-B-2024-30377|https://www.boe.es/diario_boe/xml.php?id=BOE-B-2024-30377|1. Poder adjudicador: 1.1) Nombre: Presidencia de la Agencia Estatal Consejo Superior de Investigaciones Científicas, M.P. 1.2) Número de identificación fiscal: Q2818002D. 1.3) Dirección: c/ Serrano 117. 1.4) Localidad: Madrid. 1.5) Provincia: Madrid. 1.6) Código postal: 28006. 1.7) País: España. 1.8) Código NUTS: ES300. 1.9) Teléfono: 915681781. 1.10) Fax: 915681813. 1.11) Correo electrónico: soia@csic.es 1.12) Dirección principal: http://www.csic.es 1.13) Dirección del perfil de comprador: https://contrataciondelestado.es/wps/poc?uri=deeplink:perfilContratante&idBp=XLXk9EyEnmY%3D 2. Tipo de poder adjudicador y principal actividad ejercida: 2.1) Tipo: Autoridad estatal. 2.2) Actividad principal ejercida: Servicios públicos generales. 4. Códigos CPV: 72514000 (Servicios de gestión de instalaciones informáticas). 5. Lugar principal de prestación de los servicios: ES511. 6. Descripción de la licitación: Servicio de soporte, gestión y administración de equipos informáticos para el Instituto de Investigaciones Biomédicas de Barcelona. 7. Tipo de procedimiento de adjudicación: Abierto simplificado. 9. Criterios de adjudicación: 9.1) Bolsa de horas (Ponderación: 10%). 9.2) Mejoras y/o aportaciones adicionales evaluables mediante fórmula (Ponderación: 27%). 9.3) Oferta económica (Ponderación: 55%). 9.4) Sistemas de control y seguimiento que utilizará para garantizar la correcta ejecución del contrato  (Ponderación: 8%). 10. Fecha de adjudicación: 9 de agosto de 2024. 11. Ofertas recibidas: 11.1) Número de ofertas recibidas: 2. 11.2) Número de ofertas recibidas de PYMEs: 2. 11.3) Número de ofertas recibidas de otro Estado miembro de la UE: 0. 11.4) Número de ofertas recibidas de terceros países: 0. 11.5) Número de ofertas recibidas por vía electrónica: 2. 12. Adjudicatarios: 12.1) Nombre: QUALITY TECHNOLOGY SOLUTIONS ALPE S.L.U. 12.2) Número de identificación fiscal: B91797613. 12.3) Dirección: Calle Industria 1. 12.4) Localidad: Mairena del Aljarafe. 12.6) Código postal: 41927. 12.7) País: España. 12.13) El adjudicatario es una PYME. 13. Valor de las ofertas: 13.1) Valor de la oferta seleccionada: 38.701,80 euros. 13.2) Valor de la oferta de mayor coste: 42.141,96 euros. 13.3) Valor de la oferta de menor coste: 38.701,80 euros. 16. Procedimientos de recurso: 16.1) Órgano competente para los procedimientos de recurso: 16.1.1) Nombre: Presidencia de la Agencia Estatal CSIC (Sólo para recursos de reposición). 16.1.2) Dirección: c/ Serrano 117. 16.1.3) Localidad: Madrid. 16.1.5) Código postal: 28006. 16.1.6) País: España. 16.1.7) Teléfono: +34 915681810. 16.1.9) Correo electrónico: sgoi@csic.es 16.1.10) Dirección de internet: https://sede.csic.gob.es/servicios/recursos-y-reclamaciones 18. Fecha de envío del anuncio: 26 de agosto de 2024. Madrid, 26 de agosto de 2024.- Por delegación de competencias de la Presidencia de la Agencia Estatal Consejo Superior de Investigaciones Científicas. (Resolución de 5 de diciembre de 2023, BOE de 18 de diciembre de 2023), el Secretario General, Ignacio Gutiérrez Llano.|N/A
20240829|BOE|209|BOE-S-2024-209|https://www.boe.es/boe/dias/2024/08/29/pdfs/BOE-S-2024-209.pdf|5B|V. Anuncios. - B. Otros anuncios oficiales|6110|MINISTERIO DE DEFENSA||BOE-B-2024-30378|Extracto de la Resolución de 23 de agosto de 2024, del Mando de Adiestramiento y Doctrina, por la que se convocan ayudas económicas para la formación de idiomas para personal militar del Ejército de Tierra para el año 2024.|https://www.boe.es/boe/dias/2024/08/29/pdfs/BOE-B-2024-30378.pdf|https://www.boe.es/diario_boe/txt.php?id=BOE-B-2024-30378|https://www.boe.es/diario_boe/xml.php?id=BOE-B-2024-30378|BDNS(Identif.):782498 De conformidad con lo previsto en los artículos 17.3.b y 20.8.a de la Ley 38/2003, de 17 de noviembre, General de Subvenciones, se publica el extracto de la convocatoria cuyo texto completo puede consultarse en la Base de Datos Nacional de Subvenciones (https://www.infosubvenciones.es/bdnstrans/GE/es/convocatoria/782498) Primero. Beneficiarios. Podrán a optar a solicitar las ayudas el personal del ET en activo, de los Cuerpos Comunes destinados en la estructura del ET y alumnos de formación de Centros Docentes Militares dependientes del ET Segundo.Objeto. Conceder ayudas económicas, en régimen de concurrencia competitiva, que hayan cursado, a título particular, estudios en los idiomas declarados de interés para las FAS, en el periodo comprendido entre el 1 de abril de 2022 y el 1 de septiembre de 2024, siempre que se haya mejorado o mantenido el nivel SLP en vigor al inicio de la formación y no se hayan recibido ayudas económicas de cualquier tipo por estos cursos y certificados. Tercero. Bases reguladoras. Aprobadas por Orden DEF/638/2023 de 8 de junio, por la que se establecen las bases reguladoras para la concesión de ayudas para la formación de idiomas para personal militar del ET, publicada en el BOE nº 146 de 20 de junio. Cuarto. Cuantía. La dotación económica es de 146.500 euros, con un máximo de 500 euros por persona e idioma. Quinto. Plazo de presentación de solicitudes. El plazo de presentación será de dos (2) meses contados a partir del día siguiente al de la publicación del extracto de la convocatoria en el Boletín Oficilal del Ministerio de Defensa. Sexto. Otros datos. Incompatible con cualquier otra subvención, ayudas, ingresos o recursos para la misma finalidad, incluidas las ayudas de idiomas del Plan de Acción Social del Personal Militar del Ministerio de Defensa para el año 2023 (BOD nº 65) o 2024 (BOD nº 65). La resolución de la convocatoria de las ayudas se encuentra, además de en la BDNS https://www.infosubvenciones.es/bdnstrans/GE/es/index, y en la Web del MADOC https://ejercito.defensa.gob.es/unidades/Granada/madoc/Ayudas_idiomas/index.html. Las ayudas se solicitarán obligatoriamente mediante la aplicación que figura en la intranet del MINISDEF. https://colabora.mdef.es/et/MADOC/BECAS/SitePages/Inicio.aspx Granada, 23 de agosto de 2024.- Por delegación de la Ministra de Defensa, según Orden DEF/738/2019 (BOE Nº 160, de 5 de julio de 2019), El General Jefe del Mando de Adiestramiento y Doctrina del Ejército de Tierra, José Manuel de la Esperanza y Martin-Pinillos.|N/A
20240829|BOE|209|BOE-S-2024-209|https://www.boe.es/boe/dias/2024/08/29/pdfs/BOE-S-2024-209.pdf|5B|V. Anuncios. - B. Otros anuncios oficiales|9586|MINISTERIO DE TRANSPORTES Y MOVILIDAD SOSTENIBLE||BOE-B-2024-30379|Resolución de la Autoridad Portuaria de Tarragona por la que se inicia el trámite de competencia de proyectos para la ocupación de un espacio aproximado de 16.000 m² en el muelle de Castilla norte, en régimen de concesión administrativa, destinada a las actividades de recepción, almacenamiento y expedición de materias primas líquidas a granel, en el Puerto de Tarragona.|https://www.boe.es/boe/dias/2024/08/29/pdfs/BOE-B-2024-30379.pdf|https://www.boe.es/diario_boe/txt.php?id=BOE-B-2024-30379|https://www.boe.es/diario_boe/xml.php?id=BOE-B-2024-30379|(Expediente administrativo de Dominio Público 380) Se ha presentado por la mercantil Deposa Tarragona, SLU, solicitud a la Autoridad Portuaria de Tarragona para la ocupación de un espacio aproximado de 16.000 m² en el muelle de Castilla norte, en régimen de concesión administrativa, para la habilitación de infraestructura necesaria destinada a las actividades de recepción, almacenamiento y expedición de materias primas líquidas a granel, en el Puerto de Tarragona, mediante el proyecto básico «Concesión terminal para recepción, almacenamiento y expedición de productos de graneles líquidos no químicos». Teniendo en cuenta lo establecido en el artículo 85 del referido Texto Refundido, se inicia el trámite de competencia de proyectos, a cuyo efecto se abre el plazo de un (1) mes, contado a partir de la publicación de este anuncio en el Boletín Oficial del Estado, para la presentación de otras solicitudes con el mismo objeto, en el muelle de Castilla, para el que deberán reunir los requisitos previstos en el artículo 84 del citado Texto Refundido. Dichas solicitudes se presentarán en la oficina de registro del edificio institucional de la Autoridad Portuaria de Tarragona, sita en el paseo de la Escullera, sin número, código postal 43004 de Tarragona o por registro electrónico, sin perjuicio de las obligaciones impuestas en esta materia por el ordenamiento jurídico aplicable a las personas jurídicas y a las entidades que integran el sector público. La presente resolución, al constituir un simple acto de trámite, no es susceptible de recurso alguno, de conformidad con el artículo 112.1 de la Ley 39/2015, de 1 de octubre, del Procedimiento Administrativo Común de las Administraciones Públicas. Tarragona, 21 de agosto de 2024.- Presidente, Saül Garreta Puig.|N/A
20240829|BOE|209|BOE-S-2024-209|https://www.boe.es/boe/dias/2024/08/29/pdfs/BOE-S-2024-209.pdf|5B|V. Anuncios. - B. Otros anuncios oficiales|9586|MINISTERIO DE TRANSPORTES Y MOVILIDAD SOSTENIBLE||BOE-B-2024-30380|Resolución del Consejo de Administración de la Autoridad Portuaria de Pasaia por la que se otorga al Ayuntamiento de Pasaia una concesión para la ocupación de 1.203 m2 de la lámina de agua en la zona del muelle Donibane.|https://www.boe.es/boe/dias/2024/08/29/pdfs/BOE-B-2024-30380.pdf|https://www.boe.es/diario_boe/txt.php?id=BOE-B-2024-30380|https://www.boe.es/diario_boe/xml.php?id=BOE-B-2024-30380|El Consejo de Administración de la Autoridad Portuaria de Pasaia, en su sesión ordinaria de 27 de junio de 2024, en ejercicio de la competencia otorgada por el artículo 30.5.n) del Texto Refundido de la Ley de Puertos del Estado y de la Marina Mercante, aprobado por el Real Decreto Legislativo 2/2011, de 5 de septiembre (TRLPEMM) ha otorgado al Ayuntamiento de Pasaia una concesión cuyas características principales son las siguientes: Objeto de la concesión: ocupación privativa del pantalán de la plaza Santiago de Donibane con destino a amarre de cortesía. Ámbito espacial de la concesión: ocupación del pantalán de 1.203 m2. Plazo: La concesión se otorga por un plazo de diez años. El cómputo de este plazo se iniciará el día siguiente al de la fecha de notificación al concesionario de la resolución de otorgamiento de la concesión. Tasas: a) Por ocupación de la lámina de agua. En aplicación del artículo 181.c del TRLPEMM, la cuota de la tasa de ocupación tendrá una bonificación del 50% y un gravamen de 7,5%. Zona Precio (m2/año) Ocupación m2 Base Imponible Tipo Gravamen Cuota/año 50% Bonificación Lámina de Agua 34,27 1.203m2 41.226,81 Euro 7,5% 3.092,01 Euro 1.546,00 Euro b) Tasa de actividad Dado que la puesta a disposición de un atraque de cortesía no genera ingreso alguno, no se produce el hecho imponible de la tasa de actividad según la definición contenida en el artículo 183 del TRLPEMM. Total Tasas: Tasa de ocupación privativa lámina de agua: 1.546 euros/año Pasaia, 21 de agosto de 2024.- El Presidente, Joakín Tellería Aguirrezabala.|N/A
20240829|BOE|209|BOE-S-2024-209|https://www.boe.es/boe/dias/2024/08/29/pdfs/BOE-S-2024-209.pdf|5B|V. Anuncios. - B. Otros anuncios oficiales|9586|MINISTERIO DE TRANSPORTES Y MOVILIDAD SOSTENIBLE||BOE-B-2024-30381|Resolución de la Autoridad Portuaria de Vigo por la que se somete a información pública la propuesta de Delimitación de los Espacios y Usos Portuarios (DEUP) incluido estudio ambiental estratégico.|https://www.boe.es/boe/dias/2024/08/29/pdfs/BOE-B-2024-30381.pdf|https://www.boe.es/diario_boe/txt.php?id=BOE-B-2024-30381|https://www.boe.es/diario_boe/xml.php?id=BOE-B-2024-30381|La Autoridad Portuaria de Vigo está promoviendo la Delimitación de Espacios y Usos Portuarios (D.E.U.P.) del Puerto de Vigo atendiendo a lo dispuesto en el art. 69 del Real Decreto Legislativo 2/2011, de 5 de septiembre, por el que se aprueba el Texto Refundido de la Ley de Puertos del Estado y de la Marina Mercante. Tras realizar una consulta previa a la Dirección General de Calidad y Evaluación Ambiental perteneciente al Ministerio para la Transición Ecológica y el Reto Demográfico, dicha Dirección General ha emitido una resolución de fecha 10 de octubre de 2022, por la que se formula informe ambiental estratégico de sometimiento a evaluación ambiental estratégica ordinaria y documento de alcance de la Delimitación de los espacios y usos portuarios del Puerto de Vigo. (art. 17 y s.s. de la ley 21/2013, de 9 de diciembre, de Evaluación Ambiental). En consecuencia la Autoridad Portuaria de Vigo, ha elaborado la versión inicial de la Delimitación de Espacios y Usos Portuarios (DEUP) incluido el estudio ambiental estratégico para su tramitación de acuerdo con lo dispuesto en la Ley 21/2023, de 9 de diciembre, de evaluación ambiental. A la vista de lo anterior, y, de conformidad con el Artículo 21 de la ley 21/2013, de 9 de diciembre, de evaluación ambiental se somete a información pública la versión inicial de la Delimitación de Espacios y Usos Portuarios (DEUP) incluido el estudio ambiental estratégico del Puerto de Vigo para su tramitación de acuerdo con lo dispuesto en dicha ley. Lo que se pone en conocimiento general para que en el plazo de cuarenta y cinco (45) días hábiles, contados a partir del siguiente al de la publicación del presente anuncio en el Boletín Oficial del Estado, puedan presentarse por los interesados, las alegaciones y observaciones que se estimen oportunas a través de la sede electrónica de la Autoridad Portuaria de Vigo (https://www.apvigo.es) A tal efecto y durante el referido plazo, se podrá examinar la documentación de referencia en el siguiente enlace: DEUP PUERTO DE VIGO V240801_INF PÚBLICA Vigo, 22 de agosto de 2024.- El Presidente, Carlos Botana Lagarón.|N/A
20240829|BOE|209|BOE-S-2024-209|https://www.boe.es/boe/dias/2024/08/29/pdfs/BOE-S-2024-209.pdf|5B|V. Anuncios. - B. Otros anuncios oficiales|9590|MINISTERIO DE EDUCACIÓN, FORMACIÓN PROFESIONAL Y DEPORTES||BOE-B-2024-30382|Extracto de la Resolución de 22 de agosto de 2024, de la Secretaría de Estado de Educación, por la que se convoca a los centros docentes sostenidos con fondos públicos de las Ciudades Autónomas de Ceuta y Melilla a participar en el Programa de Cooperación Territorial para la Orientación, el Avance y el Enriquecimiento Educativo PROA+ 2024-2025.|https://www.boe.es/boe/dias/2024/08/29/pdfs/BOE-B-2024-30382.pdf|https://www.boe.es/diario_boe/txt.php?id=BOE-B-2024-30382|https://www.boe.es/diario_boe/xml.php?id=BOE-B-2024-30382|BDNS(Identif.):782614 De conformidad con lo previsto en los artículos 17.3.b y 20.8.a de la Ley 38/2003, de 17 de noviembre, General de Subvenciones, se publica el extracto de la convocatoria cuyo texto completo puede consultarse en la Base de Datos Nacional de Subvenciones (https://www.infosubvenciones.es/bdnstrans/GE/es/convocatoria/782614) Primero. Beneficiarios. 1. El Programa está dirigido a los centros de Educación Primaria y Educación Secundaria sostenidos con fondos públicos que impartan todas las etapas  consideradas o parte de ellas, y tengan un porcentaje mínimo del 30% de alumnado vulnerable. 2. Se entiende por alumnado vulnerable en un sentido amplio aquel que presente alguna de las circunstancias que se describen a continuación: necesidades asistenciales (alimentación, vivienda y suministros básicos, etc.), escolares (clima familiar propicio, brecha digital, material escolar, etc.), necesidades socioeducativas (actividades complementarias, extraescolares, etc.), necesidades educativas especiales, altas capacidades, dificultades específicas de aprendizaje, incorporación tardía en el sistema educativo, dificultades para el aprendizaje por necesidades no cubiertas, así como cualquier barrera que condicione, potencial o efectivamente, las posibilidades de éxito educativo del alumnado. 3. Para participar en el programa, los centros contarán con la aceptación de un mínimo del 60% del profesorado del claustro. 4. Destinatario último: alumnado de Educación Infantil, de Educación Básica y de Educación Secundaria Posobligatoria de dichos centros, con atención a los más vulnerables educativamente. Segundo. Objeto. 1. Establecer el procedimiento para participar en el Programa de Cooperación Territorial para la Orientación, Avance y Enriquecimiento Educativo PROA+ durante el curso escolar 2024-2025, a desarrollar en los centros docentes sostenidos con fondos públicos en los que se impartan las etapas de Educación Infantil, Educación Básica y Secundaria Posobligatoria, de las ciudades autónomas de Ceuta y Melilla. 2. El objetivo final del programa PROA+ es el fortalecimiento de los centros sostenidos con fondos públicos que presentan una mayor complejidad educativa con la finalidad de mejorar los resultados escolares de todo el alumnado, especialmente de los más vulnerables, e incrementar el porcentaje de alumnado que permanece en el sistema. Tercero. Bases reguladoras. Orden ECI/1305/2005, de 20 de abril (BOE del 12 de mayo) de bases reguladoras de la concesión de Subvenciones públicas en régimen de concurrencia competitiva del Ministerio de Educación. Cuarto. Cuantía. 1. La financiación de las actuaciones previstas para el desarrollo del programa PROA+ se efectuará con cargo al crédito de la aplicación presupuestaria 18.04.322L.489.02 del Presupuesto de gastos del Ministerio de Educación, Formación Profesional y Deportes por un importe de 372.000,00 euros para el año 2024. 2. Para el desarrollo de las actuaciones del programa, la cuantía máxima del crédito que podría librarse a cada centro seleccionado sería de quince mil cien euros (15.100,00 €) para dar cobertura a los gastos derivados del desarrollo de las actividades palanca incluidas, así como para los recursos didácticos o material fungible necesarios 3. La cuantía de la ayuda asignada a cada centro será variable dependiendo de la complejidad y dimensión de los centros y de acuerdo con las actividades palanca que se van a desarrollar, así como con las prioridades y objetivos de este programa, para la consecución de la finalidad última del programa que es mejorar los resultados escolares de todo el alumnado del centro, en especial de los más vulnerables. Quinto. Plazo de presentación de solicitudes. El plazo de presentación de solicitudes será de veinte días naturales a contar desde el día siguiente al de la publicación de su extracto en el Boletín Oficial del Estado. Madrid, 22 de agosto de 2024.- El Secretario de Estado de Educación, José Manuel Bar Cendón.|N/A
20240829|BOE|209|BOE-S-2024-209|https://www.boe.es/boe/dias/2024/08/29/pdfs/BOE-S-2024-209.pdf|5B|V. Anuncios. - B. Otros anuncios oficiales|9590|MINISTERIO DE EDUCACIÓN, FORMACIÓN PROFESIONAL Y DEPORTES||BOE-B-2024-30383|Extracto de la Resolución de 22 de agosto de 2024, de la Secretaría de Estado de Educación, por la que se convoca a los centros docentes sostenidos con fondos públicos de las Ciudades Autónomas de Ceuta y Melilla a participar en el Programa de Cooperación Territorial para la Orientación, el Avance y el Enriquecimiento Educativo PROA+ 2024-2025.|https://www.boe.es/boe/dias/2024/08/29/pdfs/BOE-B-2024-30383.pdf|https://www.boe.es/diario_boe/txt.php?id=BOE-B-2024-30383|https://www.boe.es/diario_boe/xml.php?id=BOE-B-2024-30383|BDNS(Identif.):782614 De conformidad con lo previsto en los artículos 17.3.b y 20.8.a de la Ley 38/2003, de 17 de noviembre, General de Subvenciones, se publica el extracto de la convocatoria cuyo texto completo puede consultarse en la Base de Datos Nacional de Subvenciones (https://www.infosubvenciones.es/bdnstrans/GE/es/convocatoria/782614) Primero. Beneficiarios. 1. El Programa está dirigido a los centros de Educación Primaria y Educación Secundaria sostenidos con fondos públicos que impartan todas las etapas consideradas o parte de ellas, y tengan un porcentaje mínimo del 30% de alumnado vulnerable. 2. Se entiende por alumnado vulnerable en un sentido amplio aquel que presente alguna de las circunstancias que se describen a continuación: necesidades asistenciales (alimentación, vivienda y suministros básicos, etc.), escolares (clima familiar propicio, brecha digital, material escolar, etc.), necesidades socioeducativas (actividades complementarias, extraescolares, etc.), necesidades educativas especiales, altas capacidades, dificultades específicas de aprendizaje, incorporación tardía en el sistema educativo, dificultades para el aprendizaje por necesidades no cubiertas, así como cualquier barrera que condicione, potencial o efectivamente, las posibilidades de éxito educativo del alumnado. 3. Para participar en el programa, los centros contarán con la aceptación de un mínimo del 60% del profesorado del claustro. 4. Destinatario último: alumnado de Educación Infantil, de Educación Básica y de Educación Secundaria Posobligatoria de dichos centros, con atención a los más vulnerables educativamente. Segundo. Objeto. 1. Establecer el procedimiento para participar en el Programa de Cooperación Territorial para la Orientación, Avance y Enriquecimiento Educativo PROA+ durante el curso escolar 2024-2025, a desarrollar en los centros docentes sostenidos con fondos públicos en los que se impartan las etapas de Educación Infantil, Educación Básica y Secundaria Posobligatoria, de las ciudades autónomas de Ceuta y Melilla. 2. El objetivo final del programa PROA+ es el fortalecimiento de los centros sostenidos con fondos públicos que presentan una mayor complejidad educativa con la finalidad de mejorar los resultados escolares de todo el alumnado, especialmente de los más vulnerables, e incrementar el porcentaje de alumnado que permanece en el sistema. Tercero. Bases reguladoras. Orden ECI/1305/2005, de 20 de abril (BOE del 12 de mayo) de bases reguladoras de la concesión de Subvenciones públicas en régimen de concurrencia competitiva del Ministerio de Educación. Cuarto. Cuantía. 1. La financiación de las actuaciones previstas para el desarrollo del programa PROA+ se efectuará con cargo al crédito de la aplicación presupuestaria 18.04.322L.489.02 del Presupuesto de gastos del Ministerio de Educación, Formación Profesional y Deportes por un importe de 372.000,00 euros para el año 2024. 2. Para el desarrollo de las actuaciones del programa, la cuantía máxima del crédito que podría librarse a cada centro seleccionado sería de quince mil cien euros (15.100,00 €) para dar cobertura a los gastos derivados del desarrollo de las actividades palanca incluidas, así como para los recursos didácticos o material fungible necesarios. 3. La cuantía de la ayuda asignada a cada centro será variable dependiendo de la complejidad y dimensión de los centros y de acuerdo con las actividades palanca que se van a desarrollar, así como con las prioridades y objetivos de este programa, para la consecución de la finalidad última del programa que es mejorar los resultados escolares de todo el alumnado del centro, en especial de los más vulnerables. Quinto. Plazo de presentación de solicitudes. El plazo de presentación de solicitudes será de veinte días naturales a contar desde el día siguiente al de la publicación de su extracto en el Boletín Oficial del Estado. Madrid, 22 de agosto de 2024.- El Secretario de Estado de Educación, José Manuel Bar Cendón.|N/A
